{
  "version": 1,
  "cityId": "lagos",
  "sample": true,
  "authoredPlaces": [
    {
      "id": "imported-shop",
      "name": "Sample courtyard shop",
      "type": "shop",
      "latitude": 6.434245415161339,
      "longitude": 3.4191808012857963,
      "width": 4,
      "depth": 4,
      "rotation": 0,
      "floors": 3,
      "color": "#d49d75"
    }
  ]
}
